id,date_jalali,date_gregorian,title,title_english,persian_wiki_links,english_wiki_links,details,era_persian,era_english,Crime/Safety,Economy,Health,Natural Disaster,Politics,Social,Sports/Entertainment,Technology/Science,Death
1601.0,1389-09-10,2010-12-01,اعدام خدیجه ( شهلا ) جاهد ؛ پرستار ، دانشجوی روان‌شناسی ، مربی مهدکودک ، همسر دوم موقت ناصر محمدخانی و محکوم به جنایت قتل فاطمه ( لاله ) سحرخیزان (خیّر و همسر اول ناصر محمد خانی),"Execution of Khadijah (Shahla) Jahed; Nurse, psychology student, kindergarten teacher, temporary second wife of Nasser Mohammad Khani and convicted of the crime of murdering Fatima (Lalah) Saharkhizan (Khir and first wife of Nasser Mohammad Khani).",https://fa.wikipedia.org/wiki/%D9%85%D8%B1%D8%A8%DB%8C_%D9%85%D9%87%D8%AF%DA%A9%D9%88%D8%AF%DA%A9,https://en.wikipedia.org/wiki/Preschool_teacher,,جمهوری اسلامی,Islamic Republic,1,0,0,0,0,1,0,0,0
1604.0,1389-09-26,2010-12-17,خودسوزی محمد بوعزیزی دستفروش تونسی در اعتراض به توقیف کالاهایش اقدام بوعزیزی آغازگر انقلابی در تونس شد که به حکومت ۲۳ سالهٔ زین‌العابدین بن علی بر این کشور پایان بخشید ادامه این روند به جریانی موسوم به بهار عربی شد.,Tunisian peddler Mohammad Bouazizi's self-immolation in protest against the confiscation of his goods. Bouazizi's action initiated a revolution in Tunisia that ended the 23-year rule of Zine El Abdin Ben Ali over the country. The continuation of this process became the Arab Spring.,https://fa.wikipedia.org/wiki/%D8%A8%D9%87%D8%A7%D8%B1_%D8%B9%D8%B1%D8%A8%DB%8C,https://en.wikipedia.org/wiki/Arab_Spring,,جمهوری اسلامی,Islamic Republic,0,0,0,0,1,1,0,0,0
1613.0,1389-11-05,2011-01-25,آغاز انقلاب مصر با هدف سرنگونی حسنی مبارک.,The beginning of the Egyptian revolution with the aim of overthrowing Hosni Mubarak.,https://fa.wikipedia.org/wiki/%D8%AD%D8%B3%D9%86%DB%8C_%D9%85%D8%A8%D8%A7%D8%B1%DA%A9,https://en.wikipedia.org/wiki/Hosni_Mubarak,,جمهوری اسلامی,Islamic Republic,0,0,0,0,1,1,0,0,0
1614.0,1389-11-16,2011-02-05,آغاز برگزاری بیست و نهمین دوره جشنواره بین‌المللی فیلم فجر,The start of the 29th Fajr International Film Festival,https://fa.wikipedia.org/wiki/%D8%A8%DB%8C%D8%B3%D8%AA_%D9%88_%D9%86%D9%87%D9%85%DB%8C%D9%86_%D8%AF%D9%88%D8%B1%D9%87_%D8%AC%D8%B4%D9%86%D9%88%D8%A7%D8%B1%D9%87_%D8%A8%DB%8C%D9%86%E2%80%8C%D8%A7%D9%84%D9%85%D9%84%D9%84%DB%8C_%D9%81%DB%8C%D9%84%D9%85_%D9%81%D8%AC%D8%B1,<No English page found>,,جمهوری اسلامی,Islamic Republic,0,0,0,0,0,1,1,0,0
1616.0,1389-11-25,2011-02-14,اعتراضات ۲۵ بهمن جنبش سبز,The protests of the 25th of Bahman of the Green movement,https://fa.wikipedia.org/wiki/%DB%B5_%D8%A8%D9%87%D9%85%D9%86,<No English page found>,,جمهوری اسلامی,Islamic Republic,0,0,0,0,1,1,0,0,0
1617.0,1389-11-25,2011-02-14,اعتراضات جنبش سبز در ۲۵ ۱۳۸۹۱ - اعتراضات جنبش سبز در ۱ ۱۳۸۹,Protests of the Green Movement in 25 13891 - Protests of the Green Movement in 1389,,,,جمهوری اسلامی,Islamic Republic,0,0,0,0,1,1,0,0,0
1618.0,1389-11-26,2011-02-15,پایان برگزاری بیست و نهمین دوره جشنواره بین‌المللی فیلم فجر,The end of the 29th Fajr International Film Festival,https://fa.wikipedia.org/wiki/%D8%A8%DB%8C%D8%B3%D8%AA_%D9%88_%D9%86%D9%87%D9%85%DB%8C%D9%86_%D8%AF%D9%88%D8%B1%D9%87_%D8%AC%D8%B4%D9%86%D9%88%D8%A7%D8%B1%D9%87_%D8%A8%DB%8C%D9%86%E2%80%8C%D8%A7%D9%84%D9%85%D9%84%D9%84%DB%8C_%D9%81%DB%8C%D9%84%D9%85_%D9%81%D8%AC%D8%B1,<No English page found>,,جمهوری اسلامی,Islamic Republic,0,0,0,0,0,1,1,0,0
1619.0,1389-12-01,2011-02-20,تظاهرات ۱ اسفند جنبش سبز.,March 1 demonstration of the Green Movement.,,,,جمهوری اسلامی,Islamic Republic,0,0,0,0,1,1,0,0,0
1620.0,1389-12-03,2011-02-22,انتشار ویراست دوم منشور جنبش سبز,Publication of the second edition of the Green Movement Charter,https://fa.wikipedia.org/wiki/%D9%85%D9%86%D8%B4%D9%88%D8%B1_%D8%AC%D9%86%D8%A8%D8%B4_%D8%B3%D8%A8%D8%B2,<No English page found>,,جمهوری اسلامی,Islamic Republic,0,0,0,0,1,1,0,0,0
1621.0,1389-12-10,2011-03-01,تظاهرات ۱۰ اسفند جنبش سبز,March 10 demonstrations of the Green Movement,,,,جمهوری اسلامی,Islamic Republic,0,0,0,0,1,1,0,0,0
1623.0,1389-12-17,2011-03-08,تظاهرات ۱۷ اسفند جنبش سبز,The competition of Iran national football team with Qatar national football team in the 2015 Asian Nations Cup,https://fa.wikipedia.org/wiki/%DB%B7_%D8%A7%D8%B3%D9%81%D9%86%D8%AF,<No English page found>,,جمهوری اسلامی,Islamic Republic,0,0,0,0,1,1,0,0,0
1625.0,1389-12-24,2011-03-15,شورش زندان قزل‌حصار,Qezal-Hesar Prison Rebellion,https://fa.wikipedia.org/wiki/%D8%B2%D9%86%D8%AF%D8%A7%D9%86_%D9%82%D8%B2%D9%84%E2%80%8C%D8%AD%D8%B5%D8%A7%D8%B1,https://en.wikipedia.org/wiki/Ghezel_Hesar_prison,,جمهوری اسلامی,Islamic Republic,1,0,0,0,0,1,0,0,0
1626.0,1389-12-24,2011-03-15,تظاهرات ۲۴ اسفند جنبش سبز,March 24 demonstrations of the Green Movement,https://fa.wikipedia.org/wiki/%DB%B4_%D8%A7%D8%B3%D9%81%D9%86%D8%AF,<No English page found>,,جمهوری اسلامی,Islamic Republic,0,0,0,0,1,1,0,0,0
1627.0,1389-12-26,2011-03-17,بازگشایی رسمی شبکه مستند,The official reopening of the documentary network,https://fa.wikipedia.org/wiki/%D8%B4%D8%A8%DA%A9%D9%87_%D9%85%D8%B3%D8%AA%D9%86%D8%AF,https://en.wikipedia.org/wiki/IRIB_Mostanad,,جمهوری اسلامی,Islamic Republic,0,0,0,0,0,1,0,1,0
1628.0,1390-01-26,2011-04-15,آغاز اعتراضات خوزستان,The beginning of protests in Khuzestan,,,,جمهوری اسلامی,Islamic Republic,0,0,0,0,1,1,0,0,0
2364.0,1390-01-26,2011-04-15,آغاز اعتراضات خوزستان,The beginning of protests in Khuzestan,,,,جمهوری اسلامی,Islamic Republic,0,0,0,0,1,1,0,0,0
1629.0,1390-02-12,2011-05-02,انتشار آلبوم بی‌واژه از محمد اصفهانی,The release of Beybaj album by Mohammad Esfahani,https://fa.wikipedia.org/wiki/%D9%85%D8%AD%D9%85%D8%AF_%D8%A7%D8%B5%D9%81%D9%87%D8%A7%D9%86%DB%8C,https://en.wikipedia.org/wiki/Mohammad_Esfahani,,جمهوری اسلامی,Islamic Republic,0,0,0,0,0,1,1,0,0
1630.0,1390-03-02,2011-05-23,حادثه خمینی‌شهر,Khomeinishahr incident,https://fa.wikipedia.org/wiki/%D8%AD%D8%A7%D8%AF%D8%AB%D9%87_%D8%AE%D9%85%DB%8C%D9%86%DB%8C%E2%80%8C%D8%B4%D9%87%D8%B1,<No English page found>,,جمهوری اسلامی,Islamic Republic,1,0,0,0,0,1,0,0,0
1632.0,1390-03-22,2011-06-12,تظاهرات ۲۲ خرداد جنبش سبز,Demonstrations of the 22nd of June of the Green Movement,https://fa.wikipedia.org/wiki/%DB%B2_%D8%AE%D8%B1%D8%AF%D8%A7%D8%AF,<No English page found>,,جمهوری اسلامی,Islamic Republic,0,0,0,0,1,1,0,0,0
1634.0,1390-04-21,2011-07-12,آغاز سرشماری عمومی نفوس و مسکن,The beginning of the general population and housing census,,,,جمهوری اسلامی,Islamic Republic,0,0,0,0,1,1,0,0,0
1876.0,1390-04-21,2011-07-12,آغاز سرشماری عمومی نفوس و مسکن,The beginning of the general population and housing census,,,,جمهوری اسلامی,Islamic Republic,0,0,0,0,1,1,0,0,0
1637.0,1390-05-10,2011-08-01,تصویب قانون حمایت از اطفال و نوجوانان.,Approval of the Law on the Protection of Children and Adolescents.,https://fa.wikipedia.org/wiki/%D9%82%D8%A7%D9%86%D9%88%D9%86_%D8%AD%D9%85%D8%A7%DB%8C%D8%AA_%D8%A7%D8%B2_%D8%A7%D8%B7%D9%81%D8%A7%D9%84_%D9%88_%D9%86%D9%88%D8%AC%D9%88%D8%A7%D9%86%D8%A7%D9%86,<No English page found>,,جمهوری اسلامی,Islamic Republic,0,0,0,0,1,1,0,0,0
1639.0,1390-06-05,2011-08-27,اعتراض به خشک شدن دریاچه ارومیه,Protest against the drying up of Lake Urmia,,,,جمهوری اسلامی,Islamic Republic,0,0,0,0,1,1,0,0,0
1655.0,1390-11-12,2012-02-01,بازسازی لحظه ورود سید روح‌الله خمینی از فرانسه به ایران از طریق امام مقوایی توسط نیروی هوایی ارتش جمهوری اسلامی ایران,Reconstruction of the moment of Seyyed Ruhollah Khomeini's arrival from France to Iran through Imam Muqvai by the Air Force of the Islamic Republic of Iran,https://fa.wikipedia.org/wiki/%D8%A7%D9%85%D8%A7%D9%85_%D9%85%D9%82%D9%88%D8%A7%DB%8C%DB%8C,<No English page found>,,جمهوری اسلامی,Islamic Republic,0,0,0,0,1,1,0,0,0
1658.0,1390-12-08,2012-02-27,کسب نخستین جایزه اسکار سینمای ایران، در بخش بهترین فیلم غیر انگلیسی‌زبان توسط فیلم جدایی نادر از سیمین به کارگردانی اصغر فرهادی,"Winning the first Oscar award of Iranian cinema, in the category of the best non-English language film, by the film A Rare Separation from Simin, directed by Asghar Farhadi.",https://fa.wikipedia.org/wiki/%D8%A7%D8%B5%D8%BA%D8%B1_%D9%81%D8%B1%D9%87%D8%A7%D8%AF%DB%8C,https://en.wikipedia.org/wiki/Asghar_Farhadi,,جمهوری اسلامی,Islamic Republic,0,0,0,0,0,1,1,0,0
1664.0,1391-01-26,2012-04-14,رسوایی جنسی دیپلمات جمهوری اسلامی در برزیل,The sexual scandal of the diplomat of the Islamic Republic in Brazil,https://fa.wikipedia.org/wiki/%D8%B1%D8%B3%D9%88%D8%A7%DB%8C%DB%8C_%D8%AC%D9%86%D8%B3%DB%8C_%D8%AF%DB%8C%D9%BE%D9%84%D9%85%D8%A7%D8%AA_%D8%AC%D9%85%D9%87%D9%88%D8%B1%DB%8C_%D8%A7%D8%B3%D9%84%D8%A7%D9%85%DB%8C_%D8%AF%D8%B1_%D8%A8%D8%B1%D8%B2%DB%8C%D9%84,<No English page found>,,جمهوری اسلامی,Islamic Republic,1,0,0,0,1,1,0,0,0
1674.0,1391-07-12,2012-10-03,اعتراضات بازار تهران,Tehran market protests,,,,جمهوری اسلامی,Islamic Republic,0,1,0,0,1,1,0,0,0
1679.0,1391-07-26,2012-10-17,۲۶ تا ۱۴ - اعتصاب غذای نسرین ستوده در اعتراض به حکم ممنوع الخروجی دخترش,26-14 - Nasrin Sotoudeh's hunger strike in protest against her daughter's curfew,https://fa.wikipedia.org/wiki/%D8%A7%D8%B9%D8%AA%D8%B5%D8%A7%D8%A8_%D8%BA%D8%B0%D8%A7,https://en.wikipedia.org/wiki/Hunger_strike,,جمهوری اسلامی,Islamic Republic,0,0,0,0,1,1,0,0,0
1684.0,1391-09-14,2012-12-04,پایان اعتصاب غذای نسرین ستوده پس از ۴۹ روز در اعتراض به حکم ممنوع‌الخروجیِ دخترش,The end of Nasrin Sotoudeh's hunger strike after 49 days in protest against her daughter's ban on leaving,https://fa.wikipedia.org/wiki/%D9%86%D8%B3%D8%B1%DB%8C%D9%86_%D8%B3%D8%AA%D9%88%D8%AF%D9%87,https://en.wikipedia.org/wiki/Nasrin_Sotoudeh,,جمهوری اسلامی,Islamic Republic,0,0,0,0,1,1,0,0,0
1686.0,1391-09-15,2012-12-05,آتش‌سوزی در مدرسه شین‌آباد,Fire in Shinabad school,https://fa.wikipedia.org/wiki/%D8%A2%D8%AA%D8%B4%E2%80%8C%D8%B3%D9%88%D8%B2%DB%8C_%D8%AF%D8%B1_%D9%85%D8%AF%D8%B1%D8%B3%D9%87_%D8%B4%DB%8C%D9%86%E2%80%8C%D8%A2%D8%A8%D8%A7%D8%AF,<No English page found>,,جمهوری اسلامی,Islamic Republic,1,0,1,0,0,1,0,0,0
1687.0,1391-09-24,2012-12-14,غلامحسین حیدری، رئیس کل دادگستری استان یزد، از اجرای حکم حد اسلامی و قطع چهار انگشت دست دو نفر در یزد و در ملاء عام خبر داد,"Gholamhossein Heydari, Chief Justice of Yazd Province, announced the execution of the Islamic limit and cutting off four fingers of two people in Yazd and in public.",,,,جمهوری اسلامی,Islamic Republic,1,0,0,0,0,1,0,0,0
1689.0,1391-11-05,2013-01-24,اجرای حکم قطع چهار انگشت دست یک سارق در شیراز,Execution of the order to amputate four fingers of a thief in Shiraz,,,,جمهوری اسلامی,Islamic Republic,1,0,0,0,0,1,0,0,0
1690.0,1391-11-07,2013-01-26,دادستان انقلاب مازندران اعلام کرد حکم قطع چهار انگشت یک سارق در زندان ساری اجرا شد,Mazandaran Revolutionary Prosecutor announced that the order to amputate four fingers of a thief was executed in Sari prison,,,,جمهوری اسلامی,Islamic Republic,1,0,0,0,0,1,0,0,0
1717.0,1392-06-21,2013-09-12,خانه سینما در ایران بازگشایی شد. این خانه که توسط وزیر فرهنگ و ارشاد اسلامی دولت دهم در ۷ ۱۳۹۱ بسته شده بود پس از اصلاح اساسنامه و با بر سر کار آمدن دولت جدید، در روز ملی سینما بازگشایی شد.,"The cinema house was reopened in Iran. This house, which was closed by the Minister of Culture and Islamic Guidance of the 10th government in 7 1391, was reopened on the National Cinema Day after the amendment of the statute and with the new government taking office.",https://fa.wikipedia.org/wiki/%D8%AE%D8%A7%D9%86%D9%87_%D8%B3%DB%8C%D9%86%D9%85%D8%A7,<No English page found>,,جمهوری اسلامی,Islamic Republic,0,0,0,0,0,1,1,0,0
1722.0,1392-07-15,2013-10-07,آغاز به کار شبکه نسیم در سراسر ایران,The start of the Nasim network throughout Iran,https://fa.wikipedia.org/wiki/%D8%B4%D8%A8%DA%A9%D9%87_%D9%86%D8%B3%DB%8C%D9%85,https://en.wikipedia.org/wiki/IRIB_Nasim,,جمهوری اسلامی,Islamic Republic,0,0,0,0,0,1,0,1,0
1723.0,1392-07-24,2013-10-16,نخستین زنجیره انسانی حمایت از کارون ایجاد شد.,The first human chain of support for Karon was established.,https://fa.wikipedia.org/wiki/%D8%B2%D9%86%D8%AC%DB%8C%D8%B1%D9%87_%D8%A7%D9%86%D8%B3%D8%A7%D9%86%DB%8C_%D8%AD%D9%85%D8%A7%DB%8C%D8%AA_%D8%A7%D8%B2_%DA%A9%D8%A7%D8%B1%D9%88%D9%86,<No English page found>,,جمهوری اسلامی,Islamic Republic,0,0,0,0,1,1,0,0,0
1725.0,1392-08-30,2013-11-21,تظاهرات طرفدار اتحادیه اروپا در اوکراین پس از آنکه رئیس جمهور ویکتور یانوکوویچ توافق نامه ارتباط اقتصادی بین اتحادیه اروپا و اوکراین را به نفع روابط نزدیکتر با روسیه رد کرد ، آغاز می شود.,Pro-EU protests in Ukraine erupt after President Viktor Yanukovych rejected an economic association agreement between the EU and Ukraine in favor of closer ties with Russia.,,,,جمهوری اسلامی,Islamic Republic,0,0,0,0,1,1,0,0,0
1728.0,1392-09-21,2013-12-12,فیلم «گذشته» ساختهٔ اصغر فرهادی نامزد دریافت هفتاد و یکمین جایزه گلدن گلوب در بخش فیلم‌های غیرانگلیسی‌زبان شد ولی در نهایت نتوانست به جایزه دست یابد. اما در همین روز در استرالیا، فیلم «حوض نقاشی» اثر مازیار میری از سوی یونسکو به عنوان بهترین فیلم انتخاب شد.,"The film ""Past"" by Asghar Farhadi was nominated for the 71st Golden Globe Award in the category of non-English language films, but ultimately failed to win the award. But on the same day in Australia, the film ""Painting Pool"" by Maziar Miri was chosen as the best film by UNESCO.",https://fa.wikipedia.org/wiki/%D8%A7%D8%B5%D8%BA%D8%B1_%D9%81%D8%B1%D9%87%D8%A7%D8%AF%DB%8C,https://en.wikipedia.org/wiki/Asghar_Farhadi,,جمهوری اسلامی,Islamic Republic,0,0,0,0,0,1,1,0,0
1729.0,1392-10-00,2013-12-22,دی - بازنشر آلبوم پرطرفدار دهاتی، شادمهر عقیلی پس از ۱۴ سال.,D - Republishing the popular rural album by Shadmehr Aghili after 14 years.,https://fa.wikipedia.org/wiki/%D8%B4%D8%A7%D8%AF%D9%85%D9%87%D8%B1_%D8%B9%D9%82%DB%8C%D9%84%DB%8C,<No English page found>,,جمهوری اسلامی,Islamic Republic,0,0,0,0,0,1,1,0,0
1730.0,1392-10-29,2014-01-19,آتش‌سوزی ساختمان خیابان جمهوری,The fire in the building on Jumori St,https://fa.wikipedia.org/wiki/%D8%A2%D8%AA%D8%B4%E2%80%8C%D8%B3%D9%88%D8%B2%DB%8C_%D8%B3%D8%A7%D8%AE%D8%AA%D9%85%D8%A7%D9%86_%D8%AE%DB%8C%D8%A7%D8%A8%D8%A7%D9%86_%D8%AC%D9%85%D9%87%D9%88%D8%B1%DB%8C,<No English page found>,,جمهوری اسلامی,Islamic Republic,1,0,0,0,0,1,0,0,0
1731.0,1392-10-29,2014-01-19,یک ساختمان پنج‌طبقه در خیابان جمهوری تهران آتش گرفت و طی آن دو کارگر زن خود را از ساختمان پایین انداختند و جان باختند. فیلم‌هایی که از این حادثه در دنیای مجازی پخش شد، حساسیت مردم و دولتمردان را نسبت به نارسایی‌های فنی سازمان آتش‌نشانی تهران برانگیخت.,"A five-story building caught fire on Jumohri Street in Tehran, during which two female workers threw themselves from the building and died. The videos of this incident that were broadcasted in the virtual world raised the sensitivity of the people and government officials towards the technical deficiencies of the Tehran Fire Department.",https://fa.wikipedia.org/wiki/%D8%AE%DB%8C%D8%A7%D8%A8%D8%A7%D9%86_%D8%AC%D9%85%D9%87%D9%88%D8%B1%DB%8C_%D8%A7%D8%B3%D9%84%D8%A7%D9%85%DB%8C,https://en.wikipedia.org/wiki/Jomhuri,,جمهوری اسلامی,Islamic Republic,1,0,0,0,0,1,0,0,0
1740.0,1393-01-28,2014-04-17,پنج‌شنبه سیاه اوین,Black Thursday,https://fa.wikipedia.org/wiki/%D9%BE%D9%86%D8%AC%E2%80%8C%D8%B4%D9%86%D8%A8%D9%87_%D8%B3%DB%8C%D8%A7%D9%87_%D8%A7%D9%88%DB%8C%D9%86,<No English page found>,,جمهوری اسلامی,Islamic Republic,1,0,0,0,1,1,0,0,0
1750.0,1393-03-21,2014-06-11,انتشار اولیه مجموعه تلویزیونی خندوانه,The initial release of the funny TV series,,,,جمهوری اسلامی,Islamic Republic,0,0,0,0,0,1,1,0,0
1760.0,1393-05-18,2014-08-09,اندازی به مایکل براون ، یک آمریکایی آفریقایی تبار ، توسط یک افسر پلیس در فرگوسن ، میسوری رخ داد و باعث شورش شد.,"The shooting of Michael Brown, an African-American, by a police officer in Ferguson, Missouri, sparked a riot.",https://fa.wikipedia.org/wiki/%D9%85%D8%A7%DB%8C%DA%A9%D9%84_%D8%A8%D8%B1%D8%A7%D9%88%D9%86,https://en.wikipedia.org/wiki/Michael_Brown,,جمهوری اسلامی,Islamic Republic,1,0,0,0,0,1,0,0,0
1781.0,1393-12-08,2015-02-27,افتتاح رسمی شبکه افق,Official opening of the horizon network,https://fa.wikipedia.org/wiki/%D8%B4%D8%A8%DA%A9%D9%87_%D8%A7%D9%81%D9%82,https://en.wikipedia.org/wiki/IRIB_Ofogh,,جمهوری اسلامی,Islamic Republic,0,0,0,0,0,1,0,1,0
1782.0,1393-12-08,2015-02-27,افتتاح رسمی شبکه افق.,Official opening of the horizon network.,https://fa.wikipedia.org/wiki/%D8%B4%D8%A8%DA%A9%D9%87_%D8%A7%D9%81%D9%82,https://en.wikipedia.org/wiki/IRIB_Ofogh,,جمهوری اسلامی,Islamic Republic,0,0,0,0,0,1,0,1,0
1783.0,1393-12-26,2015-03-17,ناآرامی‌های ورزشگاه غدیر اهواز,Ghadir Ahvaz Stadium riots,https://fa.wikipedia.org/wiki/%D9%86%D8%A7%D8%A2%D8%B1%D8%A7%D9%85%DB%8C%E2%80%8C%D9%87%D8%A7%DB%8C_%D9%88%D8%B1%D8%B2%D8%B4%DA%AF%D8%A7%D9%87_%D8%BA%D8%AF%DB%8C%D8%B1_%D8%A7%D9%87%D9%88%D8%A7%D8%B2,<No English page found>,,جمهوری اسلامی,Islamic Republic,1,0,0,0,0,1,1,0,0
1786.0,1394-01-24,2015-04-13,پس از آن‌که دستور حسن روحانی برای بررسی مسئلهٔ تجاوز جنسی دو مأمور عربستانی در فرودگاه جده به دو نوجوان ایرانی، به علی جنتی، وزیر ارشاد ایران اعلام کرد تا زمانی که این افراد مجرم (متجاوزان به دو نوجوان ایرانی در فرودگاه جده) محاکمه بشوند و مورد مجازات قرار بگیرند، فعلاً عمره متوقف می‌شود و پروازهای ایران تعلیق خواهد شد.,"After Hassan Rouhani's order to investigate the issue of sexual assault of two Iranian teenagers at Jeddah airport, to Ali Jannati, Iran's Minister of Guidance, until these criminals (rapists of two Iranian teenagers at Jeddah airport) are tried and punished, Umrah will be stopped for the time being and flights to Iran will be suspended.",https://fa.wikipedia.org/wiki/%D8%AD%D8%B3%D9%86_%D8%B1%D9%88%D8%AD%D8%A7%D9%86%DB%8C,https://en.wikipedia.org/wiki/Hassan_Rouhani,,جمهوری اسلامی,Islamic Republic,1,0,0,0,1,1,0,0,0
1789.0,1394-02-13,2015-05-03,واقعه هتل تارا در مهاباد,Tara Hotel incident in Mahabad,https://fa.wikipedia.org/wiki/%D9%88%D8%A7%D9%82%D8%B9%D9%87_%D9%87%D8%AA%D9%84_%D8%AA%D8%A7%D8%B1%D8%A7_%D8%AF%D8%B1_%D9%85%D9%87%D8%A7%D8%A8%D8%A7%D8%AF,https://en.wikipedia.org/wiki/Mahabad_riots,,جمهوری اسلامی,Islamic Republic,1,0,0,0,0,1,0,0,0
1792.0,1394-03-08,2015-05-29,آغاز درگیری طایفه محمدی و محمدموسایی,The beginning of the conflict between the Mohammadi and Mohammad Musaei clans,https://fa.wikipedia.org/wiki/%D8%AF%D8%B1%DA%AF%DB%8C%D8%B1%DB%8C_%D8%B7%D8%A7%DB%8C%D9%81%D9%87%E2%80%8C%D8%A7%DB%8C_%D8%AF%D8%B1_%D8%A7%DB%8C%D8%B1%D8%A7%D9%86,<No English page found>,,جمهوری اسلامی,Islamic Republic,1,0,0,0,0,1,0,0,0
1801.0,1394-05-13,2015-08-04,اجرای حکم قطع دست و پای یک نفر در زندان مشهد,Execution of the sentence to amputate a person's hand and foot in Mashhad prison,,,,جمهوری اسلامی,Islamic Republic,1,0,0,0,0,1,0,0,0
1805.0,1394-06-20,2015-09-11,سقوط جرثقیل در صحن مسجدالحرام، در آستانهٔ مناسک حج تمتع، منجر به مجروح و کشته شدن تعداد زیادی از حجاج و کشته شدن یازده ایرانی شد.,"The fall of a crane in the courtyard of Masjid al-Haram, on the eve of Hajj rituals, resulted in the injury and death of a large number of pilgrims and the death of eleven Iranians.",,,,جمهوری اسلامی,Islamic Republic,1,0,0,0,0,1,0,0,0
1807.0,1394-07-01,2015-09-23,افتتاح شبکه نهال سیما,Opening of Nahal Sima network,https://fa.wikipedia.org/wiki/%D8%B4%D8%A8%DA%A9%D9%87_%D9%86%D9%87%D8%A7%D9%84,https://en.wikipedia.org/wiki/IRIB_Nahal,,جمهوری اسلامی,Islamic Republic,0,0,0,0,0,1,0,1,0
1808.0,1394-07-02,2015-09-24,بیش از ۴۶۰ ایرانی جان خود را در حادثه ازدحام حجاج در منا به دلیل خفگی و تنگی نفس بر اثر فشار زیاد و ازدحام جمعیت در طی حج و مراسم رمی جمرات در شهر مکه، عربستان سعودی از دست دادند. در این حادثه ۴۶۴ ایرانی جان خود را از دست دادند.,"More than 460 Iranians lost their lives in the crowding incident of pilgrims in Mina due to suffocation and shortness of breath due to high pressure and crowding during Hajj and Rami Jamrat ceremony in Mecca, Saudi Arabia. 464 Iranians lost their lives in this incident.",https://fa.wikipedia.org/wiki/%D8%AA%D9%86%DA%AF%DB%8C_%D9%86%D9%81%D8%B3,https://en.wikipedia.org/wiki/Shortness_of_breath,,جمهوری اسلامی,Islamic Republic,1,0,0,0,0,1,0,0,0
1812.0,1394-08-00,2015-10-23,۲۰. تظاهرات بزرگ هزاره‌ها موسوم به «جنبش تبسم» در کابل علیه حکومت افغانستان به ریاست اشرف‌غنی در اعتراض علیه تبعیض و کوتاهی در امنیت مردم هزاره برگزار شد..این اعتراضات پس از سربریده شدن یک خانواده هزاره در زابل از سوی داعش صورت گرفت.,Baqir Sahraroudi,,,,جمهوری اسلامی,Islamic Republic,1,0,0,0,1,1,0,0,0
1814.0,1394-08-15,2015-11-06,جنجال برنامه فیتیله,Controversy of the wick program,https://fa.wikipedia.org/wiki/%D8%AC%D9%86%D8%AC%D8%A7%D9%84_%D8%A8%D8%B1%D9%86%D8%A7%D9%85%D9%87_%D9%81%DB%8C%D8%AA%DB%8C%D9%84%D9%87,https://en.wikipedia.org/wiki/Fitilieh_programme_protests_in_Iran,,جمهوری اسلامی,Islamic Republic,0,0,0,0,0,1,0,0,0
1815.0,1394-08-20,2015-11-11,تظاهرات بزرگ هزاره‌ها موسوم به «جنبش تبسم» در کابل علیه حکومت افغانستان به ریاست اشرف‌غنی در اعتراض علیه تبعیض و کوتاهی در امنیت مردم هزاره برگزار شد. این اعتراضات پس از سربریده شدن یک خانواده هزاره در زابل از سوی داعش صورت گرفت.,"A large demonstration of Hazaras known as ""Smiling Movement"" was held in Kabul against the Afghan government headed by Ashraf Ghani in protest against discrimination and lack of security for the Hazara people. These protests took place after ISIS beheaded a Hazara family in Zabul.",,,,جمهوری اسلامی,Islamic Republic,1,0,0,0,1,1,0,0,0
1819.0,1394-09-28,2015-12-19,اجرای حکم قطع انگشتان دست یک سارق در شیراز,Execution of the order to cut off the fingers of a thief in Shiraz,,,,جمهوری اسلامی,Islamic Republic,1,0,0,0,0,1,0,0,0
